{
    "schema_version":  "m2_3_extension_campaign_authorization_v1",
    "recorded":  true,
    "run_id":  "m2_3_extension_campaign_20260911_221516",
    "approved_at":  "2026-09-12T01:15:16Z",
    "approved_by":  "Pedro Henrique",
    "approved_commit":  "dc5d587c5fcf7fb8dfbe00d7bacbfae47c86fcf3",
    "snapshot_id":  "m2_3_extensao_multimodelo_v1_ready",
    "snapshot_sha256":  "5b6fb011495df5fb645fe5c02982e720e656a4cf8443e5524767ac8ef8a49226",
    "positions":  [
                      "remote-gpt-5-6-luna-high-openai",
                      "remote-gpt-5-6-sol-medium-openai",
                      "remote-claude-opus-5-medium-anthropic"
                  ],
    "external_budget_cap_usd":  14,
    "execution_capability":  "real_transport",
    "execution_authorized":  true,
    "preflight_execution_authorized":  false,
    "official_campaign_authorized":  true,
    "authorization_statement":  "Autorizo a campanha real da extensão multimodelo M2.3, em uma lane sequencial, com as três posições fixadas e sob o teto externo declarado de até US$ 14."
}